Original Sentence,Cleaned Sentence,Predefined Topic,BERTopic Topic,Topic Probability
"Lo que le daban era una taza de café, dos, dos… de comida era, eran dos panes, pan Bimbo, dos rebanadas con un huevo",daban taza café dos dos comida dos panes pan bimbo dos rebanadas huevo,Living Conditions / Condiciones de vida,133,0.10314077648728781
"En los primeros braceros así, con uno o dos huevos asados en un comal, ni con sabor de nada, nomás aventarlos al comal y…  AR:	Y, ¿quién hacía la comida",primeros braceros así dos huevos asados comal sabor nomás aventarlos comal ar quién hacía comida,Living Conditions / Condiciones de vida,133,1.0
"DA:	Y eso era lo que le daban de comer a uno y un plato de frijoles, así frijol nomás así cocido y ésa era, ésa era la comida, pero tortillas no había, no daban",da daban comer plato frijoles así frijol nomás así cocido ésa ésa comida tortillas daban,Living Conditions / Condiciones de vida,50,0.3763435220823982
"DA:	Pos primero, primero este, pos lo metían a uno a un cuarto todo sin ropa y luego le echaban, con una bomba le echaban, era vaso así, un tiro de un polvo",da pos primero primero pos metían cuarto ropa luego echaban bomba echaban vaso así tiro polvo,Living Conditions / Condiciones de vida,209,0.754497171957014
"RC:	Donde comíamos era, taba bien porque había inspectores, lugares que había inspectores, lugares que no había inspectores de comida, de salud",rc comíamos taba bien inspectores lugares inspectores lugares inspectores comida salud,Living Conditions / Condiciones de vida,3,0.6738799830511569
"RC:	Como todo, o sea pollo, o sea diferente comida nos daban cada día, no la misma",rc pollo diferente comida daban cada día misma,Living Conditions / Condiciones de vida,271,0.31349905275685186
"PB:	Pos a veces y a veces manejaban ellos un carro para que… con comida, para que uno mismo comprara la comida ahí así",pb pos veces veces manejaban carro comida mismo comprara comida ahí así,Living Conditions / Condiciones de vida,3,0.8701630596420737
Tenían los bunkers pero tenían aire acondicionado y estaba bien y camitas ahí,bunkers aire acondicionado bien camitas ahí,Living Conditions / Condiciones de vida,-1,0.0
"Y como muchos se rajaban, o sea, v[e]ían que, porque decían que venían a trabajar aquí casi los mataban, se morían del calor y de la comida, se enfermaban mucho y se regresaban para atrás, nomás agarraban pa el pasaje y se iban",rajaban veían decían venían trabajar aquí casi mataban morían calor comida enfermaban regresaban atrás nomás agarraban pa pasaje iban,Living Conditions / Condiciones de vida,3,0.9304245840927217
"No, ya no ponían al cocinero, porque no eran bastante gente para que nos dieran comida",ponían cocinero bastante gente dieran comida,Living Conditions / Condiciones de vida,3,0.9159511364506463
"Ahí todos los japoneses nos llevaron a una tienda japonesa, tienda de comida",ahí japoneses llevaron tienda japonesa tienda comida,Living Conditions / Condiciones de vida,138,0.7207817150461605
"No, pos nos dieron comida, luego ropa, porque pos no traía uno ropa mas que el puro cambio cuando me contraté; zapatos nuevos, botas pa trabajar y pantalones de trabajo y camisa para salir también",pos dieron comida luego ropa pos traía ropa mas puro cambio contraté zapatos nuevos botas pa trabajar pantalones trabajo camisa salir,Living Conditions / Condiciones de vida,87,0.27304720811561983
"Y me iba a la tienda, llevaba pues, ya de a uno de a dos, de a tres pa ir a traer comida, o sea provisión",iba tienda llevaba pues dos tres pa ir traer comida provisión,Living Conditions / Condiciones de vida,413,1.0
"Pos siempre la gente aquí ha sido así, que tiene que pagar uno comida, renta, si no, no le ayudan",pos siempre gente aquí sido así pagar comida renta si ayudan,Living Conditions / Condiciones de vida,3,1.0
"Y por eso tal vez viene la discriminación porque anteponen, a nosotros los braceros nunca nos discriminaron, lo único que el trabajo era duro y mucha gente sí vivió en bonques [bunkers] onde le daban la comida muy mala",tal vez viene discriminación anteponen braceros nunca discriminaron único trabajo duro mucha gente vivió bonques bunkers onde daban comida mala,Living Conditions / Condiciones de vida,153,0.2882749875024871
"Yo no, yo como le digo, yo me tocó suerte llegar en ese lugar y hacer mi propia comida",digo tocó suerte llegar lugar hacer propia comida,Living Conditions / Condiciones de vida,3,1.0
"Yo no sabía hacer comida, a mí me enseñaron otros braceros, pero me enseñé porque en ese tiempo no había tortilla de maíz en el Condado de Orange ni de harina",sabía hacer comida enseñaron braceros enseñé tiempo tortilla maíz condado orange harina,Living Conditions / Condiciones de vida,50,0.21987648607404778
"El cuarto, pues este, está res, es… ¿Cómo podría decir",cuarto pues res cómo podría decir,Living Conditions / Condiciones de vida,53,1.0
"Este, el cuarto a pesar de esto, él estudió, cogió su doctorado en leyes y no sé, trabaja en una escuela y en algún otro programa que no, ¿con ustedes",cuarto pesar estudió cogió doctorado leyes sé trabaja escuela algún programa ustedes,Living Conditions / Condiciones de vida,-1,0.0
"Pero de todos modos todos estábamos conformes porque yo me venía pa acá y luego ya a la semana o dos, entonces ya mandaba yo dinero y ya mi esposa compraba pantalones pa los niños y comida y todo, ¿verdad",modos conformes venía pa acá luego semana dos entonces mandaba dinero esposa compraba pantalones pa niños comida verdad,Living Conditions / Condiciones de vida,-1,0.0
"AR: 	Y esa vivienda no se le hizo como para ser: “Ay, no, eso no es decente”",ar vivienda hizo ser ay decente,Living Conditions / Condiciones de vida,76,0.7976739336947033
"JG:	Sí, sí, grande, pa cuarenta y cinco gentes y más, porque los otros, ya otros, ya los cocineros ya tenían su…  AR:	Su propia vivienda",jg grande pa cuarenta cinco gentes cocineros ar propia vivienda,Living Conditions / Condiciones de vida,-1,0.0
"AR:	Y todos que llegaban como usted, con los que compartió cuarto o ese apartamento, todos se encontraban en una situación similar, ¿de que eran hombres casados o solteros",ar llegaban usted compartió cuarto apartamento encontraban situación similar hombres casados solteros,Living Conditions / Condiciones de vida,-1,0.0
"AM:	Sí, yo las veces que estuve de bracero, el campo se encargaba de darte la comida, nomás te cobraban",veces bracero campo encargaba darte comida nomás cobraban,Living Conditions / Condiciones de vida,3,1.0
"Los cocineros hacían unos tambos así de comida, papas con sabe qué tanto",cocineros hacían tambos así comida papas sabe,Living Conditions / Condiciones de vida,3,1.0
"Sí, pasabas, ibas pasando como los, a lo que se me afigura son las cárceles, como las películas de cárceles, ahí que vas ahí con tu plato y ya vas y te sientes allá a comer y allá está el Kool-Aid, unas ollotas de Kool-Aid y luego café, quien quiere café y así era la comida",pasabas ibas pasando afigura cárceles películas cárceles ahí vas ahí plato vas sientes allá comer allá koolaid unas ollotas koolaid luego café quiere café así comida,Living Conditions / Condiciones de vida,261,0.3588747854522307
"No eran buenas comidas, pero de todos modos sí daban si querías comer",buenas comidas modos daban si querías comer,Living Conditions / Condiciones de vida,3,1.0
"No tenían mas de hasta el cuatro, tercer grado, cuarto grado",mas cuatro tercer grado cuarto grado,Living Conditions / Condiciones de vida,-1,0.0
"Y nomás tenía uno hasta el cuarto grado, ya de ahí tenía que salir uno al pueblito, a Zacatecas o a estudiar una carrera, ya tenía que salir de ahí",nomás cuarto grado ahí salir pueblito zacatecas estudiar carrera salir ahí,Living Conditions / Condiciones de vida,-1,0.0
"SL:	Había unos, la gente en el mismo pueblo, hay gente que renta algún cuarto y ahí se metía uno, unos diez",sl gente mismo pueblo gente renta algún cuarto ahí metía diez,Living Conditions / Condiciones de vida,274,0.835806574390076
"CB:	A ver dígame, la información acerca de su salario que le habían dado y condiciones de la vida onde iban a vivir, a dormir, a comer y cómo se iban a transportar del lado al lugar, ¿qué fue",cb ver dígame información acerca salario dado condiciones vida onde iban vivir dormir comer cómo iban transportar lado lugar,Living Conditions / Condiciones de vida,403,0.5852231430498969
"CB:	A ver, vamos a hablar de la rutina diaria y cómo era el, cuando vivían y cómo convivían con los otros braceros",cb ver vamos hablar rutina diaria cómo vivían cómo convivían braceros,Living Conditions / Condiciones de vida,-1,0.0
SL:	Pues en la mañana temprano se levantaba uno a hacer la comida,sl pues mañana temprano levantaba hacer comida,Living Conditions / Condiciones de vida,-1,0.0
"SL:	Un día, no eran repetidas, un día le daban pollo, otro día pescado, otro día, diferentes comidas",sl día repetidas día daban pollo día pescado día diferentes comidas,Living Conditions / Condiciones de vida,-1,0.0
"Entonces despertaba, hacía de comer, trabajaba y después la hora de la comida les daban…  SL:	En Texas, aquí no",entonces despertaba hacía comer trabajaba después hora comida daban sl texas aquí,Living Conditions / Condiciones de vida,16,0.5520842655394437
"Y ya en la tarde, le daban la comida ya lo que uno quisiera, digo, lo que le tenían preparado, pues",tarde daban comida quisiera digo preparado pues,Living Conditions / Condiciones de vida,3,0.9986710119597926
"Y en la comida en Texas y en Arkansas, solamente usted iba",comida texas arkansas solamente usted iba,Living Conditions / Condiciones de vida,16,1.0
"CB:	Y en sus lugares de vivienda, en Oxnard, ¿cómo fue amueblado",cb lugares vivienda oxnard cómo amueblado,Living Conditions / Condiciones de vida,-1,0.0
"SL:	Eran unos cuartos, como había como, como recámaras y tenían un dos, ¿cómo se dice",sl cuartos recámaras dos cómo dice,Living Conditions / Condiciones de vida,34,1.0
"Yo cuando menos dormía en un cuarto en el suelo, pero dormía en un cuarto, pero hay gente que no",menos dormía cuarto suelo dormía cuarto gente,Living Conditions / Condiciones de vida,20,0.4359268082029757
"Ah no, pos al cuchillo, vámonos a la lechuga y así se llegaba la tarde, por un mes, por dos meses, cortábamos lechuga y este…  PG:	¿Quiénes fueron los que le servían la comida",ah pos cuchillo vámonos lechuga así llegaba tarde mes dos meses cortábamos lechuga pg quiénes servían comida,Living Conditions / Condiciones de vida,123,0.32924538669536313
"Mandábamos nuestro dinero, pero nos quitaba antes el diez por ciento pa la comida, no sé pa la comida nos quitaban también, nos dejaban, nuestro cheque nos llegaba de a $200, $300 dólares por quincena",mandábamos dinero quitaba diez ciento pa comida sé pa comida quitaban dejaban cheque llegaba 200 300 dólares quincena,Living Conditions / Condiciones de vida,-1,0.0
"NM:	No, no, porque pos a lo que juimos, sí cuestionábamos, porque no estaba bien las cosas y no, inmediatamente, llegaban los inspectores a revisar la barraca cómo estaba, llegaban los inspectores a ver cómo estaba la comida",nm pos juimos cuestionábamos bien cosas inmediatamente llegaban inspectores revisar barraca cómo llegaban inspectores ver cómo comida,Living Conditions / Condiciones de vida,-1,0.0
"HR:	Para ir a la secundaria o a otra parte, necesitaba salir y pues hacer gastos y no estaba uno en condiciones de, pa poder hacer gastos",hr ir secundaria parte necesitaba salir pues hacer gastos condiciones pa poder hacer gastos,Living Conditions / Condiciones de vida,1,0.9645618096236435
"Y una vez que ya lo fumigaban, entonces lo pasaban a otro cuarto, donde lo volvían a desnudar y lo ponían entonces sí en una cámara, yo creo que para tomar rayos X, sacarle sangre también",vez fumigaban entonces pasaban cuarto volvían desnudar ponían entonces cámara creo tomar rayos x sacarle sangre,Living Conditions / Condiciones de vida,85,0.09076527877158484
"Sí este, o le daban de desayunar y a la hora de la comida, en un camión llegaban los cocineros y allí le servían su lonche donde andaba usted trabajando",daban desayunar hora comida camión llegaban cocineros allí servían lonche andaba usted trabajando,Living Conditions / Condiciones de vida,64,0.31477082914179966
PG:	Nada de…  JR:	La hora de la comida y regresar otra vez al trabajo,pg jr hora comida regresar vez trabajo,Living Conditions / Condiciones de vida,145,1.0
"¿Había mejores condiciones, peores, todas eran más o menos igual",mejores condiciones peores todas menos igual,Living Conditions / Condiciones de vida,216,1.0
"Cuando estuve ya en el año [19]63, en Blythe era la misma, las mismas condiciones",año 1963 blythe misma mismas condiciones,Living Conditions / Condiciones de vida,-1,0.0
"50 y las… Digamos el, todo lo referente a para comida, para compras, ya sea frijol, ya sea maíz, pos entonces en ese tiempo no costaba nada en México",50 digamos referente comida compras frijol maíz pos entonces tiempo costaba méxico,Living Conditions / Condiciones de vida,-1,0.0
"CF:	No, nosotros no pagábanos ni un centavo porque al Gobierno de aquí de Estados Unidos nos, nos ponían buses, nos daban toda, pos comida en el camino, todo era por cuenta, ya contratado, ya por el Gobierno de aquí de Estados Unidos",cf pagábanos centavo gobierno aquí unidos ponían buses daban toda pos comida camino cuenta contratado gobierno aquí unidos,Living Conditions / Condiciones de vida,69,0.25064670863746946
"IC:	Y, ¿les dijeron qué iba a haber, las condiciones de vivir y todo eso, también les…",ic dijeron iba haber condiciones vivir,Living Conditions / Condiciones de vida,45,1.0
"IC:	Entonces también ellos les informaban de su salario, de dónde y cómo iban a vivir, sus alimentos y transportación",ic entonces informaban salario dónde cómo iban vivir alimentos transportación,Living Conditions / Condiciones de vida,403,1.0
"IC:	Y, ¿era un centro como parecía casa, parecía, era un cuarto, era una cosa grande",ic centro parecía casa parecía cuarto cosa grande,Living Conditions / Condiciones de vida,-1,0.0
"¿Nunca iban a revisar o ver cómo los estaban tratando, las condiciones",nunca iban revisar ver cómo tratando condiciones,Living Conditions / Condiciones de vida,13,1.0
"IC:	Ahora la siguiente sección es de la rutina diaria y condiciones de vida, ¿okay",ic ahora siguiente sección rutina diaria condiciones vida okay,Living Conditions / Condiciones de vida,-1,0.0
CF:	Ya no teníanos que…  IC:	¿Cuál fue su opinión de la comida,cf teníanos ic cuál opinión comida,Living Conditions / Condiciones de vida,3,1.0
"CF:	Por ejemplo estábanos, cuando estábanos acá en… Pos nos daban muy buena comida, a veces carne con chile o bistec picado, muy buena comida que nos daban",cf ejemplo estábanos estábanos acá pos daban buena comida veces carne chile bistec picado buena comida daban,Living Conditions / Condiciones de vida,193,0.32852857316925993
"A veces uno hasta de tres pisos y ahí en, así como literas, así como un cuarto aquí grande y ahí unas camas de esas que se doblan, es todo",veces tres pisos ahí así literas así cuarto aquí grande ahí unas camas doblan,Living Conditions / Condiciones de vida,20,0.39897040439285947
"IC:	¿Cuál eran las quejas más comunes, era de la comida, hospedaje, patrones o el salario",ic cuál quejas comunes comida hospedaje patrones salario,Living Conditions / Condiciones de vida,-1,0.0
"CF:	Pos decían algunos que no les gustaba la [comida], pero pos tenía que comérsela uno",cf pos decían gustaba comida pos comérsela,Living Conditions / Condiciones de vida,3,1.0
"MS:	Bueno, las condiciones pos eran de compañerismo porque todos vivían como en trailers, me imagino yo y ya",ms bueno condiciones pos compañerismo vivían trailers imagino,Living Conditions / Condiciones de vida,4,1.0
"AE:	Y primero, quiero que hable sobre de dos cosas, primero, ¿su papá le dijo cómo fueron las condiciones de vivir, pues las casas, la comida, la ropa",ae primero quiero hable dos cosas primero papá dijo cómo condiciones vivir pues casas comida ropa,Living Conditions / Condiciones de vida,10,0.870984627906996
"MS:	Una de las cosas que más le, me imagino que le ha impactado porque eso lo, lo recordaba mucho, era la comida, el compañerismo que tenía con los compañeros, y que se sentía libre",ms cosas imagino impactado recordaba comida compañerismo compañeros sentía libre,Living Conditions / Condiciones de vida,3,1.0
"MS:	Pues a él le gustaba mucho porque inclusive los fines de semana él, él nos preparaba comida como la de aquí",ms pues gustaba inclusive fines semana preparaba comida aquí,Living Conditions / Condiciones de vida,318,0.749052144207573
"Y tenían este, también comedor ahí ya en el trabajo ahí este, descontaban lo que es de las comidas",comedor ahí trabajo ahí descontaban comidas,Living Conditions / Condiciones de vida,3,0.9325477037644048
"Y ya allá cuando le dan a uno su cheque, ya viene descontado todo el seguro, según decía aquél, el seguro, las comidas este… También daban a crédito pues algún radio",allá dan cheque viene descontado seguro según decía aquél seguro comidas daban crédito pues algún radio,Living Conditions / Condiciones de vida,-1,0.0
"Descontaban, no me acuerdo, unos $3, $4 dólares de la comida, todo lo que sacaba uno a crédito, que tenían este, tienda de crédito",descontaban acuerdo 3 4 dólares comida sacaba crédito tienda crédito,Living Conditions / Condiciones de vida,-1,0.0
"ML:	Y, ¿cómo era su rutina diaria en el Rancho Cucamonga",ml cómo rutina diaria rancho cucamonga,Living Conditions / Condiciones de vida,5,1.0
"Pero para mí, pues las comidas que daban aquí diario, pues para mí era una cosa saludable, porque pues lo que nunca comí en mi tierra lo comí aquí en Estados Unidos",pues comidas daban aquí diario pues cosa saludable pues nunca comí tierra comí aquí unidos,Living Conditions / Condiciones de vida,3,0.780942561537029
"Y se sentía uno bien en las comidas, pero en el trabajo sí nos trataban mal",sentía bien comidas trabajo trataban mal,Living Conditions / Condiciones de vida,3,0.889945697750087
"Y cuando ya de plano ya comienzan a bajar la cosecha o que se está terminando ya la cosecha de la fruta, ya nomás nos iban dando nada más para pagar las comidas",plano comienzan bajar cosecha terminando cosecha fruta nomás iban dando pagar comidas,Living Conditions / Condiciones de vida,-1,0.0
"Entonces mejor dicho, mi papá compró como un terreno y sólo de cuartos había uno y así",entonces mejor dicho papá compró terreno sólo cuartos así,Living Conditions / Condiciones de vida,10,0.7241348945542758
"Y pos no había ni a quién trabajarle para el sustento, para la comida, ¿verdad",pos quién trabajarle sustento comida verdad,Living Conditions / Condiciones de vida,3,1.0
"Yo: “Ay no, algo más les han de hacer”, dije yo, por…  AE:	¿Usted ha oído a gente hablar de otros tipos de maltratos, como falta de comida o de casa o de, así de todos los días, pues cosas que la gente necesita para vivir",ay hacer dije ae usted oído gente hablar tipos maltratos falta comida casa así días pues cosas gente necesita vivir,Living Conditions / Condiciones de vida,3,0.8891110204141974
"MV:	El dinero pos lo usaba en comprar comida, comprarles a los niños lo que ocupaban y guardarlo",mv dinero pos usaba comprar comida comprarles niños ocupaban guardarlo,Living Conditions / Condiciones de vida,3,1.0
"El que se portaba mal, pos lo trataban mal y luego nos cambiaron de cocinero porque la comida no es muy buena",portaba mal pos trataban mal luego cambiaron cocinero comida buena,Living Conditions / Condiciones de vida,3,1.0
Y te sobraban unas cuantas coras [quarters] pa una soda,sobraban unas cuantas coras quarters pa soda,Living Conditions / Condiciones de vida,307,0.4333079132600687
"Me dijo un poquito de las camas, ¿pero habían otros muebles o cuántos estaban en un cuarto",dijo poquito camas muebles cuántos cuarto,Living Conditions / Condiciones de vida,20,0.8450118254574319
"Ahí una vez nos agarraron en Tijuana, aventaron así la comida y si no la cachabas, te quedabas sin comer",ahí vez agarraron tijuana aventaron así comida si cachabas quedabas comer,Living Conditions / Condiciones de vida,3,0.8962992370235198
"GM:	¿Les daban así, les daban comida en los buses que los llevaban",gm daban así daban comida buses llevaban,Living Conditions / Condiciones de vida,69,0.6831808508668562
"AA:	No, este, nos daban comida en la mañana tempranito, muy temprano, de las tres de la mañana en delante y ya salía uno a trabajar",aa daban comida mañana tempranito temprano tres mañana delante salía trabajar,Living Conditions / Condiciones de vida,323,0.9438194199703765
AA:	Pos a veces un tipo de comida muy mala,aa pos veces tipo comida mala,Living Conditions / Condiciones de vida,3,1.0
"Como por ejemplo, aquí cabían cuatro camas, dos literas ahí y dos acá",ejemplo aquí cabían cuatro camas dos literas ahí dos acá,Living Conditions / Condiciones de vida,-1,0.0
"AA:	Nadie cocinaba aquí, todo le daban a uno, la comida",aa nadie cocinaba aquí daban comida,Living Conditions / Condiciones de vida,3,0.809950519633312
"En Salinas, en Salinas cuan… no este, no, en Stockton cuando estuve allá, anduve cargando mucho el tomate, en cargas en los troques, cargando troques de tomate y pues nos daban comidas especiales, tus buenos bistés y tus buenas comidas para, nomás especiales pa nosotros, bien, pero bien",salinas salinas cuan stockton allá anduve cargando tomate cargas troques cargando troques tomate pues daban comidas especiales buenos bistés buenas comidas nomás especiales pa bien bien,Living Conditions / Condiciones de vida,48,0.5326778818201815
"A unas ocasiones pos iban, empezó a ir algún, alguno a dar escuela como particular y cobraba por este, pos no sé si cobraba un peso por el mes, con aquellos tiempos, ya con cincuenta niños pos ya él… Y le daban, pos no sé si le darían los alimentos o él los compraría, pero el caso es que empezó a ir una persona a dar escuela, pero yo no fui",unas ocasiones pos iban empezó ir algún alguno dar escuela particular cobraba pos sé si cobraba peso mes aquellos tiempos cincuenta niños pos daban pos sé si darían alimentos compraría caso empezó ir persona dar escuela,Living Conditions / Condiciones de vida,-1,0.0
"JA:	Pos las mujeres a hacer, a enseñarse a hacer tortillas y a hacer comida y todo",ja pos mujeres hacer enseñarse hacer tortillas hacer comida,Living Conditions / Condiciones de vida,50,1.0
"JA:	Sí, el mayordomo nos llevaba, iba a comprar comida, provisión a las marquetas",ja mayordomo llevaba iba comprar comida provisión marquetas,Living Conditions / Condiciones de vida,3,1.0
"Pos era un cuarto como aquí a, como aquí unos cuatro, cinco, ¿cuáles muebles iban a caber",pos cuarto aquí aquí cuatro cinco cuáles muebles iban caber,Living Conditions / Condiciones de vida,94,1.0
"JA:	Pos hacer comida para comer, también, pos no había de otra",ja pos hacer comida comer pos,Living Conditions / Condiciones de vida,3,1.0
"Entonces me dice, dice: “Allá está tu cuarto”, me dice él",entonces dice dice allá cuarto dice,Living Conditions / Condiciones de vida,26,0.977268607159365
VM:	Quisiera saber un poquito más de la rutina diaria y las condiciones en las que vivían,vm quisiera saber poquito rutina diaria condiciones vivían,Living Conditions / Condiciones de vida,5,0.6664610487278689
"VM:	Habló del almuerzo, de la comida, ¿tenían cocinero, eran, había comedores grandes, qué comían",vm habló almuerzo comida cocinero comedores grandes comían,Living Conditions / Condiciones de vida,3,0.7406242507576711
"JA:	Cuando era campo, sí había cocineros ahí, ellos nos preparaban el lonche y todo, ay Diosito, una comida muy mala",ja campo cocineros ahí preparaban lonche ay diosito comida mala,Living Conditions / Condiciones de vida,3,1.0
"Raros los días que nos daban buena comida, que decían ahora sí hay carnita de puerco, costillitas o algo, pero muy raro los días",raros días daban buena comida decían ahora carnita puerco costillitas raro días,Living Conditions / Condiciones de vida,-1,0.0
"JA:	Para todos, por ejemplo en este cuarto había cuatro, cinco baños y luego otro y así",ja ejemplo cuarto cuatro cinco baños luego así,Living Conditions / Condiciones de vida,94,1.0
"Ahorita, donde quiera hay lavadoras, en cualquier tienda hay comida preparada, ahorita la gente no sufre aunque esté solo y antes no, no había ni tortillas",ahorita quiera lavadoras cualquier tienda comida preparada ahorita gente sufre aunque solo tortillas,Living Conditions / Condiciones de vida,50,0.5071897973650374
"(tose) Ahorita qué, pos hay tortillas, va uno y compra sus tortillas y su comida si quiere",tose ahorita pos tortillas va compra tortillas comida si quiere,Living Conditions / Condiciones de vida,50,0.26487762448580754
"JA:	Y ya no sufrí yo, ya no sufrí porque entonces ya iba a la comida yo y inclusive llevaba a otros y me daban pa la gasolina",ja sufrí sufrí entonces iba comida inclusive llevaba daban pa gasolina,Living Conditions / Condiciones de vida,3,1.0
"Y empezó a haber lavadoras y tiendas con comida y no, ya no sufrimos",empezó haber lavadoras tiendas comida sufrimos,Living Conditions / Condiciones de vida,86,0.4236900824154833
"Yo me levanto y de que no hago una yarda hago otra, hago otra, limpio y pos tengo que tener en condiciones",levanto hago yarda hago hago limpio pos tener condiciones,Living Conditions / Condiciones de vida,-1,0.0
