Original Sentence,Cleaned Sentence,Predefined Topic,BERTopic Topic,Topic Probability
"Yo estaba allá, estuve yo al corriente de lo que estaba sucediendo en Chihuahua y en alguna ocasión antes de, de que sigamos este, pues se descomponía el tren y entonces llevaba yo toda la comida hasta donde estuviera el tren atorado",allá corriente sucediendo chihuahua alguna ocasión sigamos pues descomponía tren entonces llevaba toda comida tren atorado,Living Conditions / Condiciones de vida,281,0.3769914408475376
"FC:	Los distribuidores que le daban a usted la comida, ¿tenía distribuidores en México y en Estados Unidos",fc distribuidores daban usted comida distribuidores méxico unidos,Living Conditions / Condiciones de vida,-1,0.0
Siempre tuvimos platos de cartón y desechables para que hubiera higiene y todo lo demás,siempre platos cartón desechables higiene demás,Living Conditions / Condiciones de vida,-1,0.0
"ME:	Sí, pero al regreso entonces se dan a la hora de la comida y entonces a la hora de la comida, no les dábamos este, más que sándwiches para que… Porque ya con eso se iban directamente a su camión",regreso entonces dan hora comida entonces hora comida dábamos sándwiches iban directamente camión,Living Conditions / Condiciones de vida,-1,0.0
"FC:	Y estos lugares en los que ustedes distribuían la comida, ¿se sentaban en mesas o eran líneas",fc lugares ustedes distribuían comida sentaban mesas líneas,Living Conditions / Condiciones de vida,350,1.0
"ME:	Pero en la cuestión de la comida también este, les dábamos, se me había pasado decirle en el Estados Unidos, les dábamos este, también verduras",cuestión comida dábamos pasado decirle unidos dábamos verduras,Living Conditions / Condiciones de vida,3,1.0
"ME:	Pues todo depende este, hacíamos también la carne picada con chile colorado, con chile verde y pos cosas de ese tipo que es comida netamente mexicana, ¿verdad",pues depende hacíamos carne picada chile colorado chile verde pos cosas tipo comida netamente mexicana verdad,Living Conditions / Condiciones de vida,303,1.0
"ME:	Sí, (risas) pues era una comida limpia y sabrosa, ¿verdad",risas pues comida limpia sabrosa verdad,Living Conditions / Condiciones de vida,11,0.38665321649377465
"Se les pegaban muy bonito, porque se juntaban ahí con los trabajadores e iban a los cuartos y oían y eso así",pegaban bonito juntaban ahí trabajadores iban cuartos oían así,Living Conditions / Condiciones de vida,-1,0.0
"L MC:	Tenían sus galeras, sus cuartos, salones donde… En Río Vista se llamaba",l mc galeras cuartos salones río vista llamaba,Living Conditions / Condiciones de vida,107,0.9392769406687553
"L MC:	Y todavía vienen a comprar, pero en grano, en el molino, ahí está un molino que muele esto y el otro, el grano y todo y vienen unos, las lecherías Escobar y las lecherías de quien sabe quién, ellos pasan esos camiones, semi-trailers bien llenos de comida de ganado",l mc todavía vienen comprar grano molino ahí molino muele grano vienen lecherías escobar lecherías sabe quién pasan camiones semitrailers bien llenos comida ganado,Living Conditions / Condiciones de vida,-1,0.0
"L MC:	No les descontaban, nomás la comida o préstamos, ¿verdad",l mc descontaban nomás comida préstamos verdad,Living Conditions / Condiciones de vida,3,1.0
"Como le digo, había un grupo de carpinteros que andaban arreglando los cuartos de los trabajadores, de los braceros, la ventana este y el otro",digo grupo carpinteros andaban arreglando cuartos trabajadores braceros ventana,Living Conditions / Condiciones de vida,-1,0.0
"I did not want them to sell their home, because they both were used to living in the country",want sell home used living country,Living Conditions / Condiciones de vida,291,0.3727978968601228
"MC:	They fed them three meals a day, and when they were leaving, they would give them a sack lunch, but most of them would eat it before the buses would leave",mc fed three meals day leaving would give sack lunch would eat buses would leave,Living Conditions / Condiciones de vida,323,0.749752684023164
"You would see all the little bags of chips and bags of food, the empty bags of food",would see little bags chips bags food empty bags food,Living Conditions / Condiciones de vida,-1,0.0
"You know, we would just eat, gobble our food, and get back",know would eat gobble food get back,Living Conditions / Condiciones de vida,3,1.0
Mexico asked the United States government [to provide] good housing for them [braceros],mexico asked united states government provide good housing braceros,Living Conditions / Condiciones de vida,191,0.7153257986520384
"They had to make sure that they had plenty of food, and if they got hurt, they had hospitalization or whatever they needed",make sure plenty food got hurt hospitalization whatever needed,Living Conditions / Condiciones de vida,-1,0.0
They came many times without food for days,came many times without food days,Living Conditions / Condiciones de vida,-1,0.0
"Entonces, nos juntamos todos en el mismo departamento de los otros y ellos hacían almuerzo, comida y cena, pero yo me comprometía con las tortillas todos los días, un altero",entonces juntamos mismo departamento hacían almuerzo comida cena comprometía tortillas días altero,Living Conditions / Condiciones de vida,-1,0.0
"NH:	Estaba muy engreída conmigo, llegaba yo de trabajar en la obra, y llegaba y me quitaba los zapatos y le decía a mi señora que si ya había hecho comida, que le apartara primero a su papá y luego que sirviera a los demás",nh engreída conmigo llegaba trabajar obra llegaba quitaba zapatos decía señora si hecho comida apartara primero papá luego sirviera demás,Living Conditions / Condiciones de vida,254,0.40815304622141096
"Estaba La Esperanza en, la tienda era Rae McCoy, ese fue el que me dio las cartas a mí cuando arreglé yo mi residencia, Rae McCoy y mi patrón se llamaba, pos ahí está en la carta esa del cajón, esa era todo lo que tenía de dirección, yo vivía en unos cuartos de lámina",esperanza tienda rae mccoy dio cartas arreglé residencia rae mccoy patrón llamaba pos ahí carta cajón dirección vivía cuartos lámina,Living Conditions / Condiciones de vida,35,1.0
"Ahí estaba boca abajo él, estaba así, lo mataron ahí, ahí en ése cuarto, dije yo: “Pues no sé cómo le pusieron tranca por dentro a la puerta”",ahí boca abajo así mataron ahí ahí ése cuarto dije pues sé cómo pusieron tranca dentro puerta,Living Conditions / Condiciones de vida,157,0.12335838268997515
"Es como le digo, había cuatro cuadras de cuatro cuartos cada cuadra y una cuadra era de un ranchero, otra de otra, otra de otra, es que eran braceros de diferentes patrones",digo cuatro cuadras cuatro cuartos cada cuadra cuadra ranchero braceros diferentes patrones,Living Conditions / Condiciones de vida,97,1.0
"Estuve ilegalmente en Fort Davis, en Balmorhea, Texas, estuve en los aserraderos también, $60 dólares por mes, ilegal de a tiro, no estaba de bracero y comida, pero me trataron muy bien, muy bien todo, no, yo no tuve dificultad",ilegalmente fort davis balmorhea texas aserraderos 60 dólares mes ilegal tiro bracero comida trataron bien bien dificultad,Living Conditions / Condiciones de vida,-1,0.0
"You guys go in the bunkhouse, find your beds, and go to bed",guys go bunkhouse find beds go bed,Living Conditions / Condiciones de vida,20,1.0
"We didn’t have any heat in that room, but we had GI comforters for everybody",didnt heat room gi comforters everybody,Living Conditions / Condiciones de vida,-1,0.0
"In the first place, that’s a much lower standard of living than in northern Mexico",first place thats much lower standard living northern mexico,Living Conditions / Condiciones de vida,-1,0.0
"Por lo general no llegan hasta…  XX:	Pos la primaria…  MP:	Quinto, cuarto",general llegan xx pos primaria mp quinto cuarto,Living Conditions / Condiciones de vida,94,0.4557885887864622
"Íbanos a sacar nuestra comida por quince días allá al pueblo, y ya a irse a cenar al restaurant o a la cantina una cerveza y pa atrás otra vez",íbanos sacar comida quince días allá pueblo irse cenar restaurant cantina cerveza pa atrás vez,Living Conditions / Condiciones de vida,62,0.4851166586386225
"RV:	It was already before, and it was converted to living quarters for the braceros",rv already converted living quarters braceros,Living Conditions / Condiciones de vida,250,0.7677744028228047
"RB:	Was it all three meals or just a meal or two, do you remember",rb three meals meal two remember,Living Conditions / Condiciones de vida,413,1.0
RB:	So they probably would have to get up early to prepare the food that they were going to take with them to the field,rb probably would get early prepare food going take field,Living Conditions / Condiciones de vida,-1,0.0
"RV:	It was two room sheds, a little house, and they had a communal bathroom or showers, and what have you, and a laundry mat",rv two room sheds little house communal bathroom showers laundry mat,Living Conditions / Condiciones de vida,86,0.26072550092064306
"Like I said, the bathroom was not there, it was in the center of the compound, sort of",like said bathroom center compound sort,Living Conditions / Condiciones de vida,72,1.0
"RV:	Oh, no, no, paid by the farmers, the food farmers",rv oh paid farmers food farmers,Living Conditions / Condiciones de vida,0,1.0
"If not, at times, they had a bus, and we would bus them into town to buy their stuff, their needs, their toiletries or their soap, food",times bus would bus town buy stuff needs toiletries soap food,Living Conditions / Condiciones de vida,69,1.0
"At the very end, on the southeast end, was another house with four rooms",end southeast end another house four rooms,Living Conditions / Condiciones de vida,97,0.5088219804996187
"It’s what you call now a duplex, there were two houses in one, but it was one house with two rooms in each house",call duplex two houses one one house two rooms house,Living Conditions / Condiciones de vida,34,0.7097959478077581
"On the very north end, they had a garage type opening with sliding doors, and then there was a little room in there",north end garage type opening sliding doors little room,Living Conditions / Condiciones de vida,157,0.7375641507881846
"That building itself was about sixty feet long, maybe a little more, and there was a little tack room and a side door",building sixty feet long maybe little little tack room side door,Living Conditions / Condiciones de vida,-1,0.0
"Then towards the end of the building, there were three big rooms, where people lived there",towards end building three big rooms people lived,Living Conditions / Condiciones de vida,32,0.5012424357751386
"Ya nos recogían los patrones y nos llevaban a los ranchos a trabajar y ahí nos proporcionaban, pos en qué hacer comida",recogían patrones llevaban ranchos trabajar ahí proporcionaban pos hacer comida,Living Conditions / Condiciones de vida,3,0.8435688818699273
"Sí vivíamos cómodo, porque sí nos daban en qué dormir y al pueblo nos llevaban allá cada ocho días, nomás a traer la provisión, la comida y diversiones casi, pos si ni salíamos a diversiones, ¡puro trabajar",vivíamos cómodo daban dormir pueblo llevaban allá cada ocho días nomás traer provisión comida diversiones casi pos si salíamos diversiones puro trabajar,Living Conditions / Condiciones de vida,49,0.38112708727043354
"Íbamos a unos restaurancitos que había ahí, y comprábamos la comida pos de lo más barato que se podía, porque veníamos limitadones de dinero y…  MP:	O sea que ustedes pagaban, ¿pagaron sus alimentos, su transportación también",íbamos restaurancitos ahí comprábamos comida pos barato podía veníamos limitadones dinero mp ustedes pagaban pagaron alimentos transportación,Living Conditions / Condiciones de vida,-1,0.0
Luego luego en cuanto nos recibían nos daban comida,luego luego cuanto recibían daban comida,Living Conditions / Condiciones de vida,3,1.0
"Pero ahí había todo el servicio, ahí nos daban comida, ahí teníamos dormitorios, había, les decíamos barracas, donde cabía toda la gente que venía contratada",ahí servicio ahí daban comida ahí dormitorios decíamos barracas cabía toda gente venía contratada,Living Conditions / Condiciones de vida,-1,0.0
"MP:	O, ¿usted nada más la comida que se iba a comer usted",mp usted comida iba comer usted,Living Conditions / Condiciones de vida,3,1.0
"Nos juntábamos cuatro y nos uníamos para comprar la provisión juntos, para usar una estufa entre cada cuatro personas para hacer la comida, porque teníamos que hacer la comida para llevar de lonche y para, pos para comer ahí en el local donde estábamos",juntábamos cuatro uníamos comprar provisión juntos usar estufa cada cuatro personas hacer comida hacer comida llevar lonche pos comer ahí local,Living Conditions / Condiciones de vida,-1,0.0
"Y ellos pos, a veces no usaban ni las estufas porque como compraban pura comida, pos muy sencilla los pobres, porque no alcanzaba más",pos veces usaban estufas compraban pura comida pos sencilla pobres alcanzaba,Living Conditions / Condiciones de vida,3,0.8101593539663939
"Y nosotros veníamos igual, también al principio como no sabíamos cómo se manejaban las estufas de gas, pos se nos hacía que no las podíamos… No, ahí nomás le agarramos y luego luego, nos hicimos maistros luego luego, pa hacer tortillas y todo, pero hacíamos la comida y la comprábamos también, los patrones no nos compraban a nosotros nada",veníamos igual principio sabíamos cómo manejaban estufas gas pos hacía podíamos ahí nomás agarramos luego luego hicimos maistros luego luego pa hacer tortillas hacíamos comida comprábamos patrones compraban,Living Conditions / Condiciones de vida,-1,0.0
"MP:	Y no tenían ustedes problemas con la gente, por ejemplo, del sur que dice que compraban así muy poquita comida porque no les alcanzaba, ¿no tenían problemas de que ellos les agarraban su comida",mp ustedes problemas gente ejemplo sur dice compraban así poquita comida alcanzaba problemas agarraban comida,Living Conditions / Condiciones de vida,3,1.0
"RA:	Había barracas que sí, que sí tenían ese problema, pero nosotros, a mí no me tocó porque yo casi nunca me tocó vivir con mucha gente, todo el tiempo me tocaba ir así con una… Pos en compañía iríamos unos quince, veinte personas y el patrón a donde nos llevaba, era una vivienda desahogada, nos daba una recámara a cada tres, cuatro personas y ahí teníamos onde dormir, teníamos hasta mesa, teníamos sillas, teníamos todo, teníamos todo lo que se necesitaba",ra barracas problema tocó casi nunca tocó vivir mucha gente tiempo tocaba ir así pos compañía iríamos quince veinte personas patrón llevaba vivienda desahogada daba recámara cada tres cuatro personas ahí onde dormir mesa sillas necesitaba,Living Conditions / Condiciones de vida,-1,0.0
"Había unos que hacían ellos su comida y si se descuidaban, se las ganaban, ya hecha, sí, sí estaba duro en esos tiempos",hacían comida si descuidaban ganaban hecha duro tiempos,Living Conditions / Condiciones de vida,3,1.0
"Pero allá un poquito más retirado, ¿cómo era allá el ambiente, las comidas, los patrones",allá poquito retirado cómo allá ambiente comidas patrones,Living Conditions / Condiciones de vida,3,1.0
"El Licenciado Labarca dijo, partidario del… el morral quiere decir, mire, si yo voy a un trabajo al rancho, pos muy pobrecito en una ampolleta, llevo mi comida en un morral, ya unos que llevan ponchera, pos ya son…  FC:	Ya muy moderno, ¿no",licenciado labarca dijo partidario morral quiere decir mire si voy trabajo rancho pos pobrecito ampolleta llevo comida morral llevan ponchera pos fc moderno,Living Conditions / Condiciones de vida,-1,0.0
"RF:	Pos ahí se estaba unos días, le daban a uno ahí dónde dormir y comida y le daban cobijas pa taparse",rf pos ahí días daban ahí dónde dormir comida daban cobijas pa taparse,Living Conditions / Condiciones de vida,-1,0.0
"FC:	Y, ¿cómo encontró ahí su amigo las condiciones",fc cómo encontró ahí amigo condiciones,Living Conditions / Condiciones de vida,17,1.0
"FC:	Y, ¿usted se tenía que hacer su comida o ahí su patrón les daba",fc usted hacer comida ahí patrón daba,Living Conditions / Condiciones de vida,3,1.0
"RF:	No, no, en dónde eran poco, hacía uno su comida y como en los ranchos más grandes, yo creo, a mí nunca me tocó andar de eso, en ranchos muy grandes, no sé yo, a mí no me tocó ver aquí en ésta parte de este valle, que tuvieran casa de borde; no sé yo",rf dónde hacía comida ranchos grandes creo nunca tocó andar ranchos grandes sé tocó ver aquí ésta parte valle casa borde sé,Living Conditions / Condiciones de vida,0,1.0
"Yo no sé cómo le cobrarían, o si lo cobraban quién pagaría esa comida o… ¡Ah",sé cómo cobrarían si cobraban quién pagaría comida ah,Living Conditions / Condiciones de vida,3,1.0
", pos yo creo que el ranchero, yo creo pagaba la comida",pos creo ranchero creo pagaba comida,Living Conditions / Condiciones de vida,-1,0.0
"RF:	Sí y yo era creo que el ranchero pagaba la comida, yo creo, ¿verdad",rf creo ranchero pagaba comida creo verdad,Living Conditions / Condiciones de vida,-1,0.0
Así que ahí había casa en donde le hacían la comida a los braceros,así ahí casa hacían comida braceros,Living Conditions / Condiciones de vida,3,1.0
"RF:	Ya pa mucha gente a lo mejor sí les hacían la comida, no sé y si los cobraban tanto, pero cuando era poco, uno mismo hacía su alimento, uno mismo hacía su comida",rf pa mucha gente mejor hacían comida sé si cobraban mismo hacía alimento mismo hacía comida,Living Conditions / Condiciones de vida,3,0.8747998376527415
"RF:	Sí, había un cuarto ahí, como era chico el rancho ese, era un cuarto general ahí, un cuarto, cada quien tenía su camita, ¿me entiende",rf cuarto ahí chico rancho cuarto general ahí cuarto cada camita entiende,Living Conditions / Condiciones de vida,97,0.7900606342223281
"CP:	Sí, no nos daban otra cosa, pero por primera vez, primera comida que nos dieron a nosotros ahí en el tren, tenían un carro cocina en medio",cp daban cosa primera vez primera comida dieron ahí tren carro cocina medio,Living Conditions / Condiciones de vida,14,0.188035150164365
"Y ya después nos daban comida, otras cosas, sándwiches de jamón o gallina, cualquier cosa que ellos… Pero por primera vez nos dieron esa famosa bologna que…  VD:	Y, ¿se acuerda qué decían sus otros compañeros que iban en el tren",después daban comida cosas sándwiches jamón gallina cualquier cosa primera vez dieron famosa bologna vd acuerda decían compañeros iban tren,Living Conditions / Condiciones de vida,258,0.7226350209011035
"VD:	De regreso cuando terminaba su jornada, ¿se iba al comedor, les daban la comida en el comedor o ustedes se cocinaban",vd regreso terminaba jornada iba comedor daban comida comedor ustedes cocinaban,Living Conditions / Condiciones de vida,3,1.0
"VD:	Y con los demás braceros donde estaba usted en la barraca y esos cuartos, ¿no había peleas",vd demás braceros usted barraca cuartos peleas,Living Conditions / Condiciones de vida,52,1.0
Casi iba a cumplir un cuarto de siglo ahí,casi iba cumplir cuarto siglo ahí,Living Conditions / Condiciones de vida,-1,0.0
"Y yo no, yo era el, le digo a mi hija, yo le digo, a mi esposa yo le digo que yo era el cocinero, yo era el que hacía la comida",digo hija digo esposa digo cocinero hacía comida,Living Conditions / Condiciones de vida,12,0.9151162662297995
"Pues yo veía a mi mamá como que era muy buena para hacer comida, para preparar la comida, de lo que fuera, la preparaba muy sabrosa",pues veía mamá buena hacer comida preparar comida preparaba sabrosa,Living Conditions / Condiciones de vida,3,1.0
"VD:	Y todo eso podía comer de comida mexicana, se encontraban",vd podía comer comida mexicana encontraban,Living Conditions / Condiciones de vida,303,1.0
"Nomás que eran de, pos de lámina y si dejaba uno ahí la comida mucho, pos era fierro, sí",nomás pos lámina si dejaba ahí comida pos fierro,Living Conditions / Condiciones de vida,3,1.0
"Y ahí cada quien la… o a veces se hacían tres camas  VD:	Una encima, literas  JO:	Sí, literas, tipo literas, ey, cuando era mucho, mucho personal",ahí cada veces hacían tres camas vd encima literas jo literas tipo literas ey personal,Living Conditions / Condiciones de vida,20,0.44254184414488135
"Ahí hubo señoras que nos fiaban ahí de comida, fíjese",ahí señoras fiaban ahí comida fíjese,Living Conditions / Condiciones de vida,3,1.0
"(risas) La señora era muy buena gente, es que allá había mucha, vendían mucha comida a la gente",risas señora buena gente allá mucha vendían mucha comida gente,Living Conditions / Condiciones de vida,3,0.6729309854935207
"Ahí el campo era muy grande, o sea que todos rieles esos que vienen pa Laredo, ahí todo eso había, había mucha, mucha vendimia de comida, paletas, que algo de tomarse, una soda o agua pos, paleta, una paleta chupaba uno ahí",ahí campo grande rieles vienen pa laredo ahí mucha mucha vendimia comida paletas tomarse soda agua pos paleta paleta chupaba ahí,Living Conditions / Condiciones de vida,44,0.5084800473529851
"(risas) Sí, ahí se enseña uno y ya después cuando, allá en California, no, pos allá nos hacían la comida",risas ahí enseña después allá california pos allá hacían comida,Living Conditions / Condiciones de vida,19,0.8599318823413953
"Nombre, allá cuando fui pa la capital, unas comidas diferentes que me daban allá",nombre allá pa capital unas comidas diferentes daban allá,Living Conditions / Condiciones de vida,3,1.0
"Cuando yo llegué aquí también, igualmente este, nada más que aquí como, cuando [es]tuve en Manteca, California, ahí fue en un campo también y ahí pos taba la comida, ahí la gente a cada rato andaba mala del estómago porque no lavaban yo creo los trastes bien y todo el jabón, ¿verdad",llegué aquí igualmente aquí manteca california ahí campo ahí pos taba comida ahí gente cada rato andaba mala estómago lavaban creo trastes bien jabón verdad,Living Conditions / Condiciones de vida,19,0.6619299144514579
"Allá había unos dos que no me podía, no me podía acostumbrar porque pos siempre, no es igual pa hacer comida, a comer ahí nosotros",allá dos podía podía acostumbrar pos siempre igual pa hacer comida comer ahí,Living Conditions / Condiciones de vida,3,1.0
"VD:	Y, ¿no se quejaba la gente, señor Juan, de la comida, con los mayordomos o con alguien ahí, con los cocineros",vd quejaba gente señor juan comida mayordomos alguien ahí cocineros,Living Conditions / Condiciones de vida,3,1.0
"Entonces íbamos a la cantina los domingos en el día, pero íbamos porque ahí daban de comer, hacían comida para ir a comer como si fuera uno a la fonda",entonces íbamos cantina domingos día íbamos ahí daban comer hacían comida ir comer si fonda,Living Conditions / Condiciones de vida,-1,0.0
"VD:	Y, ¿ahí les hacían comida mexicana, señor Juan",vd ahí hacían comida mexicana señor juan,Living Conditions / Condiciones de vida,303,0.6226092661898909
"JT:	Se ponían a jugar, a veces se ponían a jugar a la baraja o… Y otra vez, otras veces se enojaron en la fila de la formación donde están formados para la comida y así",jt ponían jugar veces ponían jugar baraja vez veces enojaron fila formación formados comida así,Living Conditions / Condiciones de vida,-1,0.0
"JT:	En el, el de la comida no fue, nomás fue ese, ese casi puede decir que nomás fue entre unos dos",jt comida nomás casi puede decir nomás dos,Living Conditions / Condiciones de vida,3,1.0
"VD:	Donde a veces había gente que se quejaba por la comida, ¿verdad",vd veces gente quejaba comida verdad,Living Conditions / Condiciones de vida,3,1.0
"Y una vez trabajé en un molino donde hacían comida pa los animales y así a el, casi nomás al desahijes",vez trabajé molino hacían comida pa animales así casi nomás desahijes,Living Conditions / Condiciones de vida,91,0.15388469554028983
"FC:	¿Cómo les daban comida durante este proceso, señor Samuel",fc cómo daban comida proceso señor samuel,Living Conditions / Condiciones de vida,3,1.0
"SC:	Pos ponían, pos camas, cobijas, trastes para hacer la comida y, bueno pos todo",sc pos ponían pos camas cobijas trastes hacer comida bueno pos,Living Conditions / Condiciones de vida,-1,0.0
"Pos no, no están… Bueno, allá en mediodía sí le daban a uno más o menos de la comida buena",pos bueno allá mediodía daban menos comida buena,Living Conditions / Condiciones de vida,3,0.6856239745936262
"En otros, en otras partes uno se, uno se abordaba uno solo que te daban pues una, como un área así pa que cocinaras, hicieras tus comidas, hicieras tu lonche y todo eso",partes abordaba solo daban pues área así pa cocinaras hicieras comidas hicieras lonche,Living Conditions / Condiciones de vida,3,1.0
"Le dan a uno unas comidas medios malosonas, pero…  VD:	¿Ahí en el tren",dan unas comidas medios malosonas vd ahí tren,Living Conditions / Condiciones de vida,14,0.8550660248675793
"Y uno que no estaba impuesto a comer eso, pues se le hacía uno, extrañaba uno su comida",impuesto comer pues hacía extrañaba comida,Living Conditions / Condiciones de vida,3,1.0
"Allá las tiendas de comida, todo y hasta allá no, allá te despachaba toda la gente",allá tiendas comida allá allá despachaba toda gente,Living Conditions / Condiciones de vida,3,0.738510214799323
"Como entonces no había tantas cosas como ahorita, pues ahorita qué, ya de hay de todo, todo de México, todo; comidas de todo, restaurantes y entonces no, pos cuál",entonces tantas cosas ahorita pues ahorita méxico comidas restaurantes entonces pos cuál,Living Conditions / Condiciones de vida,303,1.0
